{
  "event_id": "b2c3d4e5-f6a7-8901-bcde-f12345678901",
  "task_id": "a1b2c3d4-e5f6-7890-abcd-ef1234567890",
  "event_type": "llm_call",
  "occurred_at": "2025-11-15T10:30:12+00:00",
  "cost_usd": "0.0265",
  "cost_confidence": "exact",
  "pricing_source": "provider_response",
  "pricing_version": "2025-11-01",
  "service_name": "openai",
  "provider": "openai",
  "model": "gpt-4o",
  "input_tokens": 1850,
  "output_tokens": 420,
  "cached_tokens": 512,
  "latency_ms": 1340,
  "is_retry": false,
  "retry_reason": null,
  "retry_of": null,
  "details": {
    "temperature": 0.7,
    "max_tokens": 1024,
    "system_prompt_tokens": 350
  },
  "schema_version": "1"
}
