{
  "event_id": "c3d4e5f6-a7b8-9012-cdef-123456789012",
  "task_id": "a1b2c3d4-e5f6-7890-abcd-ef1234567890",
  "event_type": "external_cost",
  "occurred_at": "2025-11-15T10:31:05+00:00",
  "cost_usd": "0.005",
  "cost_confidence": "exact",
  "pricing_source": "manual",
  "pricing_version": null,
  "service_name": "google_maps",
  "provider": null,
  "model": null,
  "input_tokens": null,
  "output_tokens": null,
  "cached_tokens": null,
  "latency_ms": 230,
  "is_retry": false,
  "retry_reason": null,
  "retry_of": null,
  "details": {
    "api_endpoint": "geocode",
    "requests_count": 1,
    "response_status": 200
  },
  "schema_version": "1"
}
